{"format": "clementina-sound", "version": 1, "id": "c2a9f1e0-1b2c-4d3e-8f40-516273849abc", "name": "Jump", "attack": 0, "decay": 4, "sustain": 0, "release": 2, "pan": 0, "frames": [{"freq": 4000, "volume": 220, "pulse": 128, "wave": 1, "gate": true}, {"freq": 5000, "volume": 200, "pulse": 128, "wave": 1, "gate": true}, {"freq": 6000, "volume": 160, "pulse": 96, "wave": 1, "gate": false}]}
